{
  "result_id": "res_ecc78ff7cfdacc81",
  "analysis_id": "ngspedigree",
  "analysis_version": "v0.9.0",
  "sample_set_id": "sset_1999b1dbf7dafa4e",
  "input_artifact_ids": [
    "beagle_wholegenome_main_qcpass_v1",
    "sites_wholegenome_thin1k_v1"
  ],
  "params_hash": "sha256:4934c961a5255080b8ca4a995b6163777b3e481c7fc0222a29a68826f0d0e12c",
  "params": {
    "theta_cut": 0.0625
  },
  "output_layer_id": "ngspedigree_1999b1db_wg_v1",
  "coordinate_scope": null,
  "status": "active",
  "created_at": "2026-05-12T08:10:00Z",
  "created_by_action_id": "act_1715000240000_w22"
}