{
  "result_id": "res_a9bdd883af3989f9",
  "analysis_id": "ngsrelate",
  "analysis_version": "v2.0.0",
  "sample_set_id": "sset_2f17041eb0d98bc9",
  "input_artifact_ids": [
    "beagle_LG28_main_qcpass_v1",
    "sites_LG28_thin1k_v1"
  ],
  "params_hash": "sha256:d0a2a59b5f46730a1fe6ef17999f1995a18f4a9048ea3d246948a2905230a85f",
  "params": {
    "F_unknown": -1,
    "p": "ALL",
    "haploid": false,
    "minimum_freq": 0.05
  },
  "output_layer_id": "ngsrelate_2f17041e_C_gar_LG28_v1",
  "coordinate_scope": {
    "chrom": "C_gar_LG28",
    "start_bp": null,
    "end_bp": null
  },
  "status": "active",
  "created_at": "2026-05-08T09:14:00Z",
  "created_by_action_id": "act_1715000080000_r4t"
}