{
  "result_id": "res_1b1a6a730de030a6",
  "analysis_id": "mendelian",
  "analysis_version": "v1.2.0",
  "sample_set_id": "sset_c6e37713a16622bf",
  "input_artifact_ids": [
    "beagle_wholegenome_main_qcpass_v1",
    "sites_wholegenome_thin1k_v1"
  ],
  "params_hash": "sha256:0815f89a1edc106d19f57d019a2845d965c5e8ab8b0e37514108023a841c5dc5",
  "params": {
    "mode": "trio_check",
    "min_depth": 4
  },
  "output_layer_id": "mendelian_c6e37713_wg_v1",
  "coordinate_scope": null,
  "status": "active",
  "created_at": "2026-05-11T15:42:00Z",
  "created_by_action_id": "act_1715000220000_v01"
}